index,groundtruthkeyword,claim
idx570,nevada GOP elector trump,BREAKING Nevada GOP elector cast ballot for Donald Trump declaring him winner of 6 Electoral vote in Nevada
idx569,pollster britain,Best pollster in Britain wrote this morning that this clearly was a stolen election  that it
idx568,michigan count mailed ballot,Michigan legislature refuse to allow count mailed ballot ahead of Election Day like other state do
idx574,ballot authenticat,how these ballot were authenticat  because if there a problem in the system about authentication  that would seriously affect the ENTIRE ELECTION
idx575,democrat literature,Man Caught Handing Out Democrat Literature to voter IN LINE TO VOTE
idx582,130k vote biden,They literally added 130k vote for Biden while 0 for Trump
idx583,trump challenger eject,TRUMP Challenger being eject from ballot canvassing in Detroit
idx583,trump eject ballot,TRUMP Challenger being eject from ballot canvassing in Detroit
idx587,trump won 70% landslide,Trump Won a 70% Plus Landslide Election
idx591,republican house legislature biden seat,Republican Won 28 of 29 Most Competitive House Seat Added 3 State Legislature Did Not Lose a Single House Race But Joe Biden Won
idx594,dominion own china,Dominion Voting system is own by China
idx594,dominion connect internet,Dominion Voting system has modems that connect to the Internet
idx594,dominion solarwind,Dominion Voting system has SolarWind for its monitoring system
idx597,detroit ballot backdat,Detroit city worker blows whistle  claims ballot were ordered backdat
idx600,trump won november 3rd,Donald Trump won with 410 electoral vote on November 3rd
idx602,germany server military, server recovered in Germany was in fact seized by the U.S. Military 
idx605,clark 70%,"Clark County Nevada Dominion machine ALSO Kicked out About 70% of ballot"
idx606,surprise ballot dump, Then  one by one  they started to magically disappear as surprise ballot dump were counted
idx610,nevada non citizen vot,many thousand of non citizen vot in Nevada
idx616,data manipulat dominion,Dominion Voting machine Are At the Center Of Material Data Manipulat Concerns in the 2020 Election
idx621,trump won stopped counting,Trump won his election on Tuesday November 3rd and six state stopped counting when he won
idx623,dominion whistleblower forward,whistleblower from Dominion have come forward
idx625,manufactur fake ballot,stopped counting until they could manufactur fake ballot
idx630,illegal campaigning poll,ILLEGAL campaigning INSIDE of a poll location in Philly
idx633,suspicio ballot drop,From Michigan Poll Watcher on the Scene Republicans Allegedly Witnessed Suspicio Vehicles Drop Off ballot 
idx634,master fix mail-in ballot,Two months ago Confessions of a voter fraud I was a master at fix mail-in ballot 
idx639,audit error rate,Audit of voting machine reveal ERROR rate
idx641,arizona machine marker, in-person voter in Arizona were given felt tip marker that were unreadable by machine
idx642,veritas fed agent usps,Project Veritas has obtained recordings of fed agent interrogating pennsylvania USPS whistleblower re: backdating ballot
idx647,sharpie pen arizona,Trump voter were forced to use Sharpie rather than pen in Arizona  invalidating their ballot
idx657,trump vote delete PA,"Watch 113,870 vote being delete from Trump vote in PA"
idx656,pennsylvania watch ballot count,Pennsylvania prevented us from watch much of the Ballot count
idx653,detroit coach vote biden,City of Detroit election worker and employees coaching and trying to coach voter to vote for Joe Biden and the Democrat Party
idx661,sharpie invalidat ballot,Multiple report that sharpie use are invalidat ballot
idx666,cobb evidence fraud,Evidence of voter fraud is being destroyed in Cobb County  GA TODAY
idx669,ballot scan times,Ruby Freeman caught on camera  scan the same stack of ballot THREE TIMES
idx667,colorado dominion delet,The Colorado Secretary of State is DELET DOMINION DOCUMENTS from the official Colorado Secretary of State website
idx672,pennsylvania remov biden win,Biden knocked back to 259 as Pennsylvania remov as a Biden win
idx671,ballot fill return mail,Over 23K Pennsylvania ballot Were Fill Out and return Before They Were Ever Mail To voter
idx670,trump data dumps between,WHY Trump deafet happened in FOUR DATA DUMPS between 1:34 a.m
idx678,giuliani unlawful ballot,Rudy Giuliani say hundred of thousand of ballot were cast unlawful in Pennsylvania
idx673,dominion ware county,Ware County  Ga has broken the Dominion algorithm
idx673,sequester dominion,Using sequester Dominion Equipment  Ware County ran a equal number of Trump vote and Biden vote through the Tabulator and the Tabulator reported a 26% lead for Biden
idx681,pre-filled ballot biden,Several Queens Village residents are receiving pre-filled out ballot for Joe Biden
idx685,kraken release media,Sidney Powell Release the Voter Fraud Kraken On Media to Their Faces
idx682,every single vote mail biden,"mysteriously  every single mail vote of the 10,0000  that was count all went to Joe Biden"
idx687,dominion server germany,Attorney Sidney Powell confirms Alleged Dominion Server in Germany Were Confiscated
idx690,ballot arriv vehicle biden,"At least 130,000 ballot arriv in 3 vehicle in Detroit  Michigan  ALL for Biden"
idx692,dominion easy chang vote,Dominion We began to look and realized how easy it is to chang vote
idx694,force people vote mail,The more people you force to vote by mail Sancho said the more invalid ballot you will generate
idx698,excess state voter,The new study show 1.8M excess or ghost voter in 353 counties across 29 state
idx700,ballot old address, Los Angeles County has my deceased mother listed as active and sent her a ballot to her old address on 10/5/20
idx703,biden ballot dump night,"Voter Fraud in Wisconsin Massive Dump of Over 100,000 ballot for Biden All the Sudden Appear Over night"
idx701,poll station out republican,Watch as democrat in this Georgia poll station kicks out all Republican observers then pull out secret suitcases filled with ballot
idx7,"wisconsin absentee 120,000","wisconsin  somebody has to be indefinitely confined in order to vote absentee in the past there were 20000 people this past election there were 120,000"
idx7,wisconsin republican lock out,republican were lock out of the vote counting process in wisconsin
idx17,nevada vote residen,"1,000 people vote from nevada who don't meet nevada residen requirements"
idx17,nevada 500 dead, 500 people voted from nevada who were dead
idx25,more register vote wisconsin,there were more vote than register voter in wisconsin
idx30,pennsylvania disenfranchis,thousand of pennsylvania residents have been disenfranchis
idx37,wisconsin ballot pristine,ballot identified in pristine condition similar to fraudulent ballot in georgia michigan and wisconsin
idx39,poll watcher observe ballot,the democrat prevented poll watcher and observe from legally observing the ballot review
idx47,georgia suitcase vote spike,look at this picture from the georgia video huge vote spike for biden during the same time the suitcase of ballot started to be scanned
idx49,forc sharpie poll, arizona poll worker forc voter to use sharpie thereby invalidat ballot
idx93,secretary state destroy ballot,it's unlawful to certify any election that cannot be verified when the secretary of state destroy ballot images in violation of federal law
idx103,vote michigan more people,the great state of michigan with vote being far more than the number of people who voted cannot certify the election
idx125,georgia deceased vote,"illegal vote in georgia including as many as 10,315 deceased individuals"
idx136,democrat vote after election,democrat vote after the election was over to using radical left
idx156,dominion es&s vulnerabl,dominion and es&s system similar in their vulnerabl
idx160,nevada voting irregularities,there are thousand of instances of voting irregularit in nevada
idx170,dominion vote stolen biden,dominion voting system  use in state where tens of thousand of vote were stolen from trump and given to biden
idx194,michigan ballot carry,michigan witness say ballot were carry in from the rear of the poll station basement at 4:30 a.m.
idx238,software steal trump vote,"corrupted software use in michigan county found steal 6,000 vote from trump"
idx254,dead people vote,watch the trump campaign jason miller details the voting irregularit in several state  and show examples of dead people vote
idx255,trump won landslide,on november 3rd 2020 president trump won a landslide election
idx260,destroy ballot image,it's all about destroy of ballot image and scans
idx263,dominion night vote, dominion unilaterally helped one team with late night vote tallies
idx265,dominion foreign control election,we cannot allow foreign companies such as dominion to control our election
idx283,fraud signal detect,calls for engineering system approach for signal detection methods to detect fraud for election integrity
idx324,biden fraud extensive team,remember when joe biden said he had the most extensive voter fraud team in political history
idx352,late ballot 100% biden,not a single member of the mainstream media cnn  msdnc  cnnlite have the intellectual curiosity to ask why 100% of the late ballot went for biden
idx399,100% biden vote trump,"an hourly update of result  gives biden 100% of the new vote in the key state of michigan more than 128,000 vote and none for trump"
idx402,dominion switch vote pennsylvania,data analysis find 221000 pennsylvania vote switch from president trump to biden by dominion
idx435,find vote night fraud,criminals hurried to find enough fraud vote in middle of night
idx438,poll wedding trash,a wedding took place in oklahoma after a building was use as a poll place and look what they found in the trash
idx525,cuba dominion 2020 election,cuba involvement in the 2020 election through dominion smartmatic voting systems
idx528,software glitch counties 47,"a software glitch cause 6,000 vote in michigan for president trump to be count for biden in 47 counties"
idx537,below age people vote,everybody knows that dead people below age people illegal immigrants vote as fake signature were collected from prisoners
idx537,illegal immigrant vote,everybody knows that dead people  below age people illegal immigrant vote as fake signature were collected from prisoners
idx545,georgia throw ballot signature,in georgia they throw away the envelope with the signature that the ballot came in 
idx553,trump election night vote switch,trump vote on election night overwhelm the dominion smartmatic vote switch algorithm
idx581,suing stop count,minutes after suing to stop count in pennsylvania with 1.1 million ballot uncounted
idx617,extra ballot biden,extra ballot started flowing in for biden at 2am 3am and even days after
idx637,georgia recount signature check,the georgia recount they are only counting vote cast  not checking for validation not check signature
idx651,election night data trump vote switch,election night data showss million of vote either switch from president trump to biden or were lost
idx676,illegal vote receiv,tens of thousand of vote were illegal receiv after 8 p.m. on tuesday election day totally and easily changing the result  in pennsylvania
idx677,georgia change of address,there are 132k change of address flags in fulton county georgia alone
